{
  "work_item_id": "WI-CPP-001",
  "current_state": "DISCOVERED",
  "profile": "FEATURE",
  "effort": "MEDIUM",
  "history": [
    {
      "from_state": "INIT",
      "to_state": "DISCOVERED",
      "timestamp": "2026-09-22T12:00:00Z",
      "actor": "agent-repository-analyst",
      "reason": "Autonomous 5-layer intelligence discovered and practices adapted"
    }
  ],
  "updated_at": "2026-09-22T12:00:00Z"
}
